<?xml version="1.0" encoding="utf-8" ?>
<CharSet DisplayName="Lowercase English alphabets" xmlns:xsi="http://www.w3.org/2001/XMLSchema-instance" xsi:schemaLocation="ASCIIsome.Resources.CharSets CharSetSchema.xsd">
  <CharInfo GrayscaleIndex="0.21409" Character="a"/>
  <CharInfo GrayscaleIndex="0.26391" Character="b"/>
  <CharInfo GrayscaleIndex="0.15864" Character="c"/>
  <CharInfo GrayscaleIndex="0.26404" Character="d"/>
  <CharInfo GrayscaleIndex="0.21643" Character="e"/>
  <CharInfo GrayscaleIndex="0.19965" Character="f"/>
  <CharInfo GrayscaleIndex="0.28651" Character="g"/>
  <CharInfo GrayscaleIndex="0.24106" Character="h"/>
  <CharInfo GrayscaleIndex="0.13311" Character="i"/>
  <CharInfo GrayscaleIndex="0.19153" Character="j"/>
  <CharInfo GrayscaleIndex="0.22855" Character="k"/>
  <CharInfo GrayscaleIndex="0.14861" Character="l"/>
  <CharInfo GrayscaleIndex="0.25568" Character="m"/>
  <CharInfo GrayscaleIndex="0.20240" Character="n"/>
  <CharInfo GrayscaleIndex="0.21362" Character="o"/>
  <CharInfo GrayscaleIndex="0.25647" Character="p"/>
  <CharInfo GrayscaleIndex="0.25523" Character="q"/>
  <CharInfo GrayscaleIndex="0.13587" Character="r"/>
  <CharInfo GrayscaleIndex="0.17882" Character="s"/>
  <CharInfo GrayscaleIndex="0.17171" Character="t"/>
  <CharInfo GrayscaleIndex="0.20239" Character="u"/>
  <CharInfo GrayscaleIndex="0.15712" Character="v"/>
  <CharInfo GrayscaleIndex="0.23556" Character="w"/>
  <CharInfo GrayscaleIndex="0.18201" Character="x"/>
  <CharInfo GrayscaleIndex="0.19103" Character="y"/>
  <CharInfo GrayscaleIndex="0.18484" Character="z"/>
</CharSet>
