<?xml version="1.0" encoding="utf-8" ?>
<CharSet DisplayName="Numerals" xmlns:xsi="http://www.w3.org/2001/XMLSchema-instance" xsi:schemaLocation="ASCIIsome.Resources.CharSets CharSetSchema.xsd">
  <CharInfo GrayscaleIndex="0.26270" Character="0"/>
  <CharInfo GrayscaleIndex="0.18531" Character="1"/>
  <CharInfo GrayscaleIndex="0.19975" Character="2"/>
  <CharInfo GrayscaleIndex="0.19922" Character="3"/>
  <CharInfo GrayscaleIndex="0.21424" Character="4"/>
  <CharInfo GrayscaleIndex="0.19647" Character="5"/>
  <CharInfo GrayscaleIndex="0.25800" Character="6"/>
  <CharInfo GrayscaleIndex="0.16855" Character="7"/>
  <CharInfo GrayscaleIndex="0.28226" Character="8"/>
  <CharInfo GrayscaleIndex="0.25795" Character="9"/>
</CharSet>
