<?xml version="1.0" encoding="utf-8" ?>
<CharSet DisplayName="Uppercase Russian alphabets" xmlns:xsi="http://www.w3.org/2001/XMLSchema-instance" xsi:schemaLocation="ASCIIsome.Resources.CharSets CharSetSchema.xsd">
  <CharInfo GrayscaleIndex="0.21229" Character="А"/>
  <CharInfo GrayscaleIndex="0.24278" Character="Б"/>
  <CharInfo GrayscaleIndex="0.27045" Character="В"/>
  <CharInfo GrayscaleIndex="0.14285" Character="Г"/>
  <CharInfo GrayscaleIndex="0.31134" Character="Д"/>
  <CharInfo GrayscaleIndex="0.21602" Character="Е"/>
  <CharInfo GrayscaleIndex="0.23992" Character="Ё"/>
  <CharInfo GrayscaleIndex="0.28596" Character="Ж"/>
  <CharInfo GrayscaleIndex="0.20904" Character="З"/>
  <CharInfo GrayscaleIndex="0.26244" Character="И"/>
  <CharInfo GrayscaleIndex="0.29582" Character="Й"/>
  <CharInfo GrayscaleIndex="0.21981" Character="К"/>
  <CharInfo GrayscaleIndex="0.22889" Character="Л"/>
  <CharInfo GrayscaleIndex="0.27128" Character="М"/>
  <CharInfo GrayscaleIndex="0.23306" Character="Н"/>
  <CharInfo GrayscaleIndex="0.24683" Character="О"/>
  <CharInfo GrayscaleIndex="0.23306" Character="П"/>
  <CharInfo GrayscaleIndex="0.21172" Character="Р"/>
  <CharInfo GrayscaleIndex="0.18769" Character="С"/>
  <CharInfo GrayscaleIndex="0.15891" Character="Т"/>
  <CharInfo GrayscaleIndex="0.18653" Character="У"/>
  <CharInfo GrayscaleIndex="0.26702" Character="Ф"/>
  <CharInfo GrayscaleIndex="0.20683" Character="Х"/>
  <CharInfo GrayscaleIndex="0.26478" Character="Ц"/>
  <CharInfo GrayscaleIndex="0.19706" Character="Ч"/>
  <CharInfo GrayscaleIndex="0.30418" Character="Ш"/>
  <CharInfo GrayscaleIndex="0.33191" Character="Щ"/>
  <CharInfo GrayscaleIndex="0.21800" Character="Ъ"/>
  <CharInfo GrayscaleIndex="0.27651" Character="Ы"/>
  <CharInfo GrayscaleIndex="0.20956" Character="Ь"/>
  <CharInfo GrayscaleIndex="0.22130" Character="Э"/>
  <CharInfo GrayscaleIndex="0.32982" Character="Ю"/>
  <CharInfo GrayscaleIndex="0.25545" Character="Я"/>
</CharSet>
