<?xml version="1.0" encoding="utf-8" ?>
<CharSet DisplayName="ASCII symbols" xmlns:xsi="http://www.w3.org/2001/XMLSchema-instance" xsi:schemaLocation="ASCIIsome.Resources.CharSets CharSetSchema.xsd">
  <CharInfo GrayscaleIndex="0.00000" Character=" "/>
  <CharInfo GrayscaleIndex="0.09771" Character="!"/>
  <CharInfo GrayscaleIndex="0.08598" Character="&quot;"/>
  <CharInfo GrayscaleIndex="0.26690" Character="#"/>
  <CharInfo GrayscaleIndex="0.24652" Character="$"/>
  <CharInfo GrayscaleIndex="0.26139" Character="%"/>
  <CharInfo GrayscaleIndex="0.32644" Character="&amp;"/>
  <CharInfo GrayscaleIndex="0.06079" Character="&apos;"/>
  <CharInfo GrayscaleIndex="0.15888" Character="("/>
  <CharInfo GrayscaleIndex="0.15899" Character=")"/>
  <CharInfo GrayscaleIndex="0.10613" Character="*"/>
  <CharInfo GrayscaleIndex="0.11651" Character="+"/>
  <CharInfo GrayscaleIndex="0.05551" Character=","/>
  <CharInfo GrayscaleIndex="0.04805" Character="-"/>
  <CharInfo GrayscaleIndex="0.03526" Character="."/>
  <CharInfo GrayscaleIndex="0.12511" Character="/"/>
  <CharInfo GrayscaleIndex="0.07051" Character=":"/>
  <CharInfo GrayscaleIndex="0.09098" Character=";"/>
  <CharInfo GrayscaleIndex="0.11943" Character="&lt;"/>
  <CharInfo GrayscaleIndex="0.12557" Character="="/>
  <CharInfo GrayscaleIndex="0.11959" Character="&gt;"/>
  <CharInfo GrayscaleIndex="0.15773" Character="?"/>
  <CharInfo GrayscaleIndex="0.29367" Character="@"/>
  <CharInfo GrayscaleIndex="0.18132" Character="["/>
  <CharInfo GrayscaleIndex="0.12511" Character="\"/>
  <CharInfo GrayscaleIndex="0.18132" Character="]"/>
  <CharInfo GrayscaleIndex="0.13303" Character="^"/>
  <CharInfo GrayscaleIndex="0.07293" Character="_"/>
  <CharInfo GrayscaleIndex="0.01924" Character="`"/>
  <CharInfo GrayscaleIndex="0.17471" Character="{"/>
  <CharInfo GrayscaleIndex="0.11072" Character="|"/>
  <CharInfo GrayscaleIndex="0.17472" Character="}"/>
  <CharInfo GrayscaleIndex="0.07732" Character="~"/>
</CharSet>
