<?xml version="1.0" encoding="utf-8" ?>
<CharSet DisplayName="Lowercase Russian alphabets" xmlns:xsi="http://www.w3.org/2001/XMLSchema-instance" xsi:schemaLocation="ASCIIsome.Resources.CharSets CharSetSchema.xsd">
  <CharInfo GrayscaleIndex="0.21409" Character="а"/>
  <CharInfo GrayscaleIndex="0.28532" Character="б"/>
  <CharInfo GrayscaleIndex="0.23818" Character="в"/>
  <CharInfo GrayscaleIndex="0.12600" Character="г"/>
  <CharInfo GrayscaleIndex="0.26104" Character="д"/>
  <CharInfo GrayscaleIndex="0.21638" Character="е"/>
  <CharInfo GrayscaleIndex="0.24028" Character="ё"/>
  <CharInfo GrayscaleIndex="0.23565" Character="ж"/>
  <CharInfo GrayscaleIndex="0.17241" Character="з"/>
  <CharInfo GrayscaleIndex="0.22485" Character="и"/>
  <CharInfo GrayscaleIndex="0.26698" Character="й"/>
  <CharInfo GrayscaleIndex="0.17971" Character="к"/>
  <CharInfo GrayscaleIndex="0.19101" Character="л"/>
  <CharInfo GrayscaleIndex="0.24651" Character="м"/>
  <CharInfo GrayscaleIndex="0.19864" Character="н"/>
  <CharInfo GrayscaleIndex="0.21368" Character="о"/>
  <CharInfo GrayscaleIndex="0.19646" Character="п"/>
  <CharInfo GrayscaleIndex="0.25652" Character="р"/>
  <CharInfo GrayscaleIndex="0.15858" Character="с"/>
  <CharInfo GrayscaleIndex="0.13771" Character="т"/>
  <CharInfo GrayscaleIndex="0.19103" Character="у"/>
  <CharInfo GrayscaleIndex="0.32498" Character="ф"/>
  <CharInfo GrayscaleIndex="0.18200" Character="х"/>
  <CharInfo GrayscaleIndex="0.22578" Character="ц"/>
  <CharInfo GrayscaleIndex="0.16197" Character="ч"/>
  <CharInfo GrayscaleIndex="0.26258" Character="ш"/>
  <CharInfo GrayscaleIndex="0.28888" Character="щ"/>
  <CharInfo GrayscaleIndex="0.18789" Character="ъ"/>
  <CharInfo GrayscaleIndex="0.24428" Character="ы"/>
  <CharInfo GrayscaleIndex="0.17799" Character="ь"/>
  <CharInfo GrayscaleIndex="0.18359" Character="э"/>
  <CharInfo GrayscaleIndex="0.27440" Character="ю"/>
  <CharInfo GrayscaleIndex="0.21188" Character="я"/>
</CharSet>
